{
  "review_stage": "final",
  "run_id": "atam-20261026T021243Z-ce7765fc",
  "reviewed_report": "05_atam_report.json",
  "checks": [
    {
      "check_id": "STRUCT-SCHEMA",
      "category": "structure",
      "source": "automated",
      "result": "pass",
      "location": "",
      "finding": "No violations found.",
      "correction": null,
      "resolution": null
    },
    {
      "check_id": "STRUCT-SECTIONS",
      "category": "structure",
      "source": "automated",
      "result": "pass",
      "location": "",
      "finding": "No violations found.",
      "correction": null,
      "resolution": null
    },
    {
      "check_id": "SEM-REPORT-STATUS",
      "category": "semantic_state",
      "source": "automated",
      "result": "pass",
      "location": "",
      "finding": "No violations found.",
      "correction": null,
      "resolution": null
    },
    {
      "check_id": "SEM-ANALYSIS-STATUS",
      "category": "semantic_state",
      "source": "automated",
      "result": "pass",
      "location": "",
      "finding": "No violations found.",
      "correction": null,
      "resolution": null
    },
    {
      "check_id": "SEM-STATUS-TRACE",
      "category": "semantic_state",
      "source": "automated",
      "result": "pass",
      "location": "",
      "finding": "No violations found.",
      "correction": null,
      "resolution": null
    },
    {
      "check_id": "SEM-GAP-ACTIVITY",
      "category": "semantic_state",
      "source": "automated",
      "result": "pass",
      "location": "",
      "finding": "No violations found.",
      "correction": null,
      "resolution": null
    },
    {
      "check_id": "SEM-GAPS-PRESERVED",
      "category": "semantic_state",
      "source": "automated",
      "result": "pass",
      "location": "",
      "finding": "No violations found.",
      "correction": null,
      "resolution": null
    },
    {
      "check_id": "EVID-RATIONALE-SUFFIX",
      "category": "evidence_traceability",
      "source": "automated",
      "result": "pass",
      "location": "",
      "finding": "No violations found.",
      "correction": null,
      "resolution": null
    },
    {
      "check_id": "EVID-NO-GAP-IDS",
      "category": "evidence_traceability",
      "source": "automated",
      "result": "pass",
      "location": "",
      "finding": "No violations found.",
      "correction": null,
      "resolution": null
    },
    {
      "check_id": "EVID-IDS-EXIST",
      "category": "evidence_traceability",
      "source": "automated",
      "result": "pass",
      "location": "",
      "finding": "No violations found.",
      "correction": null,
      "resolution": null
    },
    {
      "check_id": "EVID-FINDING-TRACE",
      "category": "evidence_traceability",
      "source": "automated",
      "result": "pass",
      "location": "",
      "finding": "No violations found.",
      "correction": null,
      "resolution": null
    },
    {
      "check_id": "EVID-SCENARIO-REF",
      "category": "evidence_traceability",
      "source": "automated",
      "result": "pass",
      "location": "",
      "finding": "No violations found.",
      "correction": null,
      "resolution": null
    },
    {
      "check_id": "EVID-DECISION-CITES",
      "category": "evidence_traceability",
      "source": "automated",
      "result": "pass",
      "location": "",
      "finding": "No violations found.",
      "correction": null,
      "resolution": null
    },
    {
      "check_id": "EVID-POINT-CITES",
      "category": "evidence_traceability",
      "source": "automated",
      "result": "pass",
      "location": "",
      "finding": "No violations found.",
      "correction": null,
      "resolution": null
    },
    {
      "check_id": "EVID-APPROACH-CITES",
      "category": "evidence_traceability",
      "source": "automated",
      "result": "pass",
      "location": "",
      "finding": "No violations found.",
      "correction": null,
      "resolution": null
    },
    {
      "check_id": "UNC-ABSENCE-BASIS",
      "category": "uncertainty",
      "source": "automated",
      "result": "pass",
      "location": "",
      "finding": "No violations found.",
      "correction": null,
      "resolution": null
    },
    {
      "check_id": "UNC-PERF-ATTAINMENT",
      "category": "uncertainty",
      "source": "automated",
      "result": "pass",
      "location": "",
      "finding": "No violations found.",
      "correction": null,
      "resolution": null
    },
    {
      "check_id": "UNC-RESPONSE-MEASURE",
      "category": "uncertainty",
      "source": "automated",
      "result": "pass",
      "location": "",
      "finding": "No violations found.",
      "correction": null,
      "resolution": null
    },
    {
      "check_id": "UNC-PRIORITY",
      "category": "uncertainty",
      "source": "automated",
      "result": "pass",
      "location": "",
      "finding": "No violations found.",
      "correction": null,
      "resolution": null
    },
    {
      "check_id": "COV-ACTIVITIES",
      "category": "method_coverage",
      "source": "automated",
      "result": "pass",
      "location": "",
      "finding": "No violations found.",
      "correction": null,
      "resolution": null
    },
    {
      "check_id": "COV-SCENARIOS",
      "category": "method_coverage",
      "source": "automated",
      "result": "pass",
      "location": "",
      "finding": "No violations found.",
      "correction": null,
      "resolution": null
    },
    {
      "check_id": "REF-NO-REFERENCE-OUTPUTS",
      "category": "reference_boundary",
      "source": "automated",
      "result": "pass",
      "location": "",
      "finding": "No violations found.",
      "correction": null,
      "resolution": null
    },
    {
      "check_id": "REF-INPUTS-PRESERVED",
      "category": "reference_boundary",
      "source": "automated",
      "result": "pass",
      "location": "",
      "finding": "No violations found.",
      "correction": null,
      "resolution": null
    },
    {
      "check_id": "REF-METADATA",
      "category": "reference_boundary",
      "source": "automated",
      "result": "pass",
      "location": "",
      "finding": "No violations found.",
      "correction": null,
      "resolution": null
    },
    {
      "check_id": "STRUCT-R1",
      "category": "structure",
      "source": "reviewer",
      "result": "pass",
      "location": "",
      "finding": "Report structure unchanged by revision: title, metadata, evaluation_inputs (verbatim), and evaluation_results with utility_tree, architectural_approaches, 19 analysis_records in scenario order, scenarios and semantic_state.",
      "correction": null,
      "resolution": "No change needed; passed in the initial review, and the revision edited only text values inside existing records."
    },
    {
      "check_id": "SEM-R1",
      "category": "semantic_state",
      "source": "reviewer",
      "result": "pass",
      "location": "/ATAM_Evaluation/evaluation_results/semantic_state",
      "finding": "Status values still match their evidence: context/driver/architecture evidence 'partial', scenario_analysis_status 'partial', report_status 'draft'.",
      "correction": null,
      "resolution": "No change needed; semantic_state was not edited."
    },
    {
      "check_id": "SEM-R2",
      "category": "semantic_state",
      "source": "reviewer",
      "result": "pass",
      "location": "/ATAM_Evaluation/evaluation_results/semantic_state/gaps",
      "finding": "All merged gaps G-1-1..G-4-7 remain, each with activity, missing evidence and resolution question.",
      "correction": null,
      "resolution": "No change needed; no gap was dropped or edited. The revisions only qualified claims, so they leave no new unresolved item that needs a new gap. Existing gaps G-3-5, G-3-6, G-4-3, G-4-6, G-4-7, G-2-6 and G-3-1 still cover the qualified points."
    },
    {
      "check_id": "EVID-R1",
      "category": "evidence_traceability",
      "source": "reviewer",
      "result": "pass",
      "location": "/ATAM_Evaluation/evaluation_results/analysis_records",
      "finding": "Findings still trace to cited AE/BD/AP ids. No evidence id was added, and all citations remain subsets of 04_analysis.json.",
      "correction": null,
      "resolution": "No change needed; the revisions did not alter any evidence citation."
    },
    {
      "check_id": "EVID-R2",
      "category": "evidence_traceability",
      "source": "reviewer",
      "result": "pass",
      "location": "/ATAM_Evaluation/evaluation_results/analysis_records/6/findings/non_risks/0/rationale",
      "finding": "NR-2's rationale relied on the uninspected interaction definitions referred to by AE-1.",
      "correction": "Rest the rationale on AE-3, AE-4 and AE-6 and keep AE-1 only as the source of the caveat.",
      "resolution": "Rephrased the rationale. The single interaction pattern is now 'suggested' by the base Handler (AE-6) and the framework-owned Main module (AE-3). It states that the documented interactions referred to by the documentation status (AE-1) are not supplied, so the pattern cannot be checked against them. Citations and basis 'inferred' are unchanged, and gap G-4-3 remains visible."
    },
    {
      "check_id": "UNC-R1",
      "category": "uncertainty",
      "source": "reviewer",
      "result": "pass",
      "location": "/ATAM_Evaluation/evaluation_results/analysis_records/6/findings/non_risks/0/description",
      "finding": "NR-2 claimed as settled that interaction 'follows one uniform contract'.",
      "correction": "Qualify as a candidate uniform contract whose exclusive use is not described.",